[
  {
    "id": "math_sum_evens_claim_001",
    "paper_id": "math_sum_evens",
    "section": "1",
    "source_span": {
      "source_file": "source/source.pdf",
      "start": { "page": 1, "offset": 0 },
      "end": { "page": 1, "offset": 80 }
    },
    "informal_text": "The sum of two even natural numbers is even.",
    "claim_type": "theorem",
    "mathematical_density": "high",
    "status": "machine_checked",
    "linked_symbols": [],
    "linked_assumptions": [],
    "linked_formal_targets": [
      "ScientificMemory.Mathematics.SumEvens.sum_evens"
    ]
  }
]
