[
  {
    "id": "chem_dilution_reference_claim_001",
    "paper_id": "chem_dilution_reference",
    "section": "1",
    "source_span": {
      "source_file": "source/source.pdf",
      "start": {
        "page": 1,
        "offset": 0
      },
      "end": {
        "page": 1,
        "offset": 120
      }
    },
    "informal_text": "When a solution is diluted by increasing volume by a positive factor k while solute amount is fixed, concentration scales inversely: c\u2080 v\u2080 = (c\u2080/k)(v\u2080 k) for positive rational concentration, volume, and k.",
    "claim_type": "theorem",
    "mathematical_density": "high",
    "status": "machine_checked",
    "linked_symbols": [
      "chem_dilution_reference_symbol_c0",
      "chem_dilution_reference_symbol_v0",
      "chem_dilution_reference_symbol_k"
    ],
    "linked_assumptions": [
      "chem_dilution_reference_assumption_001",
      "chem_dilution_reference_assumption_002"
    ],
    "linked_formal_targets": [
      "ScientificMemory.Chemistry.Solutions.DilutionRef.solute_amount_preserved_under_dilution"
    ]
  },
  {
    "id": "chem_dilution_reference_claim_002",
    "paper_id": "chem_dilution_reference",
    "section": "1",
    "source_span": {
      "source_file": "source/source.pdf",
      "start": {
        "page": 1,
        "offset": 121
      },
      "end": {
        "page": 1,
        "offset": 220
      }
    },
    "informal_text": "If two solution states carry the same fixed solute amount so that c\u2080 v\u2080 = c\u2081 v\u2081 with v\u2081 \u2260 0, then c\u2081 = (c\u2080 v\u2080)/v\u2081.",
    "claim_type": "theorem",
    "mathematical_density": "high",
    "status": "machine_checked",
    "linked_symbols": [
      "chem_dilution_reference_symbol_c0",
      "chem_dilution_reference_symbol_c1",
      "chem_dilution_reference_symbol_v0",
      "chem_dilution_reference_symbol_v1"
    ],
    "linked_assumptions": [
      "chem_dilution_reference_assumption_001",
      "chem_dilution_reference_assumption_002"
    ],
    "linked_formal_targets": [
      "ScientificMemory.Chemistry.Solutions.DilutionRef.conc_from_fixed_amount"
    ]
  }
]